{
  "$schema": "../../schemas/signal_profile.schema.json",
  "id": "composite_pal",
  "display_name": "Composite PAL B/G (European consumer)",
  "connection": "composite",
  "standard": "pal_bg",

  "bandwidth": {
    "luma_mhz": 5.0,
    "chroma_i_mhz": 1.3,
    "chroma_q_mhz": 1.3,
    "source": {
      "url": "https://en.wikipedia.org/wiki/PAL",
      "retrieved_at": "2026-05-26",
      "notes": "PAL-B/G luma BW 5.0 MHz; chroma U and V at 1.3 MHz each. Phase alternation removes hue drift but introduces 'Hanover bars' on misconverged receivers."
    }
  },

  "artifacts": {
    "dot_crawl_strength": 0.50,
    "rainbow_banding": 0.25,
    "ringing_amount": 0.30,
    "ghosting_offset_pixels": 0.0,
    "noise_type": "line",
    "noise_strength": 0.07
  },

  "effective_tvl": 420,
  "subcarrier_mhz": 4.43361875,
  "h_freq_khz": 15.625
}
